{
  "schemaVersion": "1.0",
  "id": "canvas-confirm-password-c8e199d7-c8d8-4ab5-abc9-58765599bd4c",
  "component": "div",
  "importId": "CanvasConfirmPasswordC8e199d7C8d84ab5Abc958765599bd4cComponent",
  "data": {
    "imageUrl": "/generated/canvas-confirm-password-c8e199d7-c8d8-4ab5-abc9-58765599bd4c-thumbnail.png",
    "imageAlt": "Confirm password",
    "sealed": true,
    "sourceHtml": "<div class=\"w-full\" style=\"width:280px;box-sizing:border-box\"><label for=\"confirm-pw-c8e199d7-c8d8-4ab5-abc9-58765599bd4c\" class=\"mb-1 block text-xs font-medium text-brandcolor-textstrong\">Confirm password</label><input id=\"confirm-pw-c8e199d7-c8d8-4ab5-abc9-58765599bd4c\" type=\"password\" name=\"confirmPassword\" autocomplete=\"new-password\" class=\"confirm-password-canvas-input w-full\" placeholder=\"••••••••\" required minlength=\"8\" /></div>"
  }
}